{
  "id": "w3m-text-generation-inference-tgi-batch-concat-duration",
  "type": "metric_exposure",
  "name": "TGI batch-concatenation duration histogram",
  "engine_id": "text-generation-inference",
  "metric_name": "tgi_batch_concat_duration",
  "metric_type": "histogram",
  "unit": "seconds",
  "exposure": "prometheus",
  "endpoint": ":9000/metrics",
  "histogram_buckets": [
    0.0001,
    0.00015,
    0.000225,
    0.0003375,
    0.00050625,
    0.00075938,
    0.00113906,
    0.00170859,
    0.00256289,
    0.00384434,
    0.0057665,
    0.00864976,
    0.01297463,
    0.01946195,
    0.02919293,
    0.04378939,
    0.06568408,
    0.09852613,
    0.14778919,
    0.22168378,
    0.33252567,
    0.49878851,
    0.74818276,
    1.12227415,
    1.68341122,
    2.52511683,
    3.78767524,
    5.68151287,
    8.5222693,
    12.78340395,
    19.17510592,
    28.76265888,
    43.14398833,
    64.71598249,
    97.07397374
  ],
  "labels": [
    "method"
  ],
  "enabled_by_default": true,
  "phase_scoped": true,
  "verified_negatively": null,
  "notes": "TGI main, router/src/server.rs plus backends/v3/src/{backend,queue,lib}.rs, read 2026-10-04. On by default: the Prometheus recorder is built unconditionally with PrometheusBuilder and an HTTP listener on prometheus_port, default 9000, so nothing has to be opted into. Label keys are method (prefill|decode) on the batch families, err on tgi_request_failure, and reason on tgi_batch_concat - there are no model or engine labels, so every series is fleet-wide. method=decode at the call site. Absent from the published docs table - one of the six metrics where the documentation lags the source.",
  "status": "verified",
  "confidence": 0.94,
  "updated": "2026-10-04",
  "sources": [
    "obs-tgi-metrics-doc",
    "obs-tgi-router-server-rs",
    "w3m-tgi-v3-backend-metrics",
    "w3m-tgi-prometheus-buckets-and-port"
  ]
}
