{
  "id": "w3m-niche-lmdeploy-turbomind-lmdeploy-num-requests-succeeded",
  "type": "metric_exposure",
  "name": "LMDeploy succeeded-request gauge",
  "engine_id": "niche-lmdeploy-turbomind",
  "metric_name": "lmdeploy:num_requests_succeeded",
  "metric_type": "gauge",
  "unit": "requests",
  "exposure": "prometheus",
  "endpoint": ":23333/metrics",
  "histogram_buckets": null,
  "labels": [
    "model_name",
    "engine"
  ],
  "enabled_by_default": true,
  "phase_scoped": null,
  "verified_negatively": null,
  "notes": "InternLM/lmdeploy main, PrometheusStatLogger in lmdeploy/metrics/loggers.py, read 2026-10-04. On by default and requires NO flag: the endpoint is simply available at the API server port (23333 by default). Label keys are model_name and engine on every metric, where engine carries the dp_rank. Bucket construction reuses vLLM's build_buckets / build_1_2_5_buckets idiom. prometheus_client.Info, set once at construction.",
  "status": "verified",
  "confidence": 0.94,
  "updated": "2026-10-04",
  "sources": [
    "obs-lmdeploy-metrics-loggers",
    "w3m-lmdeploy-metrics-loggers-typing",
    "obs-lmdeploy-metrics-doc",
    "obs-lmdeploy-monitoring-dir"
  ]
}
