{
  "id": "w3m-triton-inference-server-nv-inference-compute-infer-duration",
  "type": "metric_exposure",
  "name": "Triton cumulative compute-infer duration",
  "engine_id": "triton-inference-server",
  "metric_name": "nv_inference_compute_infer_duration_us",
  "metric_type": "counter",
  "unit": "microseconds",
  "exposure": "prometheus",
  "endpoint": ":8002/metrics",
  "histogram_buckets": null,
  "labels": [
    "model",
    "version"
  ],
  "enabled_by_default": true,
  "phase_scoped": null,
  "verified_negatively": null,
  "notes": "Triton main, docs/user_guide/metrics.md, read 2026-10-04. On by default: 'By default, these metrics are available at http://localhost:8002/metrics', and the endpoint is pure pull - 'not pushed or published to any remote server'. tritonserver --allow-metrics=false turns the whole thing off. Labels are model and version, and crucially the LATENCY families are per MODEL, per request-update - not per-request observations as in vLLM/SGLang/TGI. Framework-backend only.",
  "status": "verified",
  "confidence": 0.94,
  "updated": "2026-10-04",
  "sources": [
    "obs-triton-metrics-doc",
    "obs-triton-trace-doc"
  ]
}
