{
  "id": "w3m-sglang-sglang-num-decode-host-receive-queue-reqs",
  "type": "metric_exposure",
  "name": "SGLang decode host-receive queue gauge",
  "engine_id": "sglang",
  "metric_name": "sglang:num_decode_host_receive_queue_reqs",
  "metric_type": "gauge",
  "unit": "requests",
  "exposure": "prometheus",
  "endpoint": ":30000/metrics",
  "histogram_buckets": null,
  "labels": [
    "model_name",
    "engine_type",
    "tp_rank",
    "pp_rank",
    "moe_ep_rank"
  ],
  "enabled_by_default": false,
  "phase_scoped": null,
  "verified_negatively": null,
  "notes": "SGLang main, python/sglang/srt/observability/metrics_collector.py, read 2026-10-04. NOT ON BY DEFAULT: nothing is exported unless --enable-metrics (ServerArgs default False), which is also the only thing that mounts /metrics on the server port. Label keys are model_name, engine_type, tp_rank, pp_rank, moe_ep_rank (plus dp_rank under data parallelism, priority under priority scheduling, and anything in extra_metric_labels). Bucket ladders are overridable per histogram via get_histogram_conf_from_env. Disaggregation-only: emitted and populated on a prefill/decode split deployment. On a unified deployment these are 0 rather than absent, so their presence is not evidence that the deployment is disaggregated.",
  "status": "verified",
  "confidence": 0.94,
  "updated": "2026-10-04",
  "sources": [
    "obs-sglang-metrics-collector",
    "obs-sglang-production-metrics-doc",
    "w3m-sglang-prometheus-middleware",
    "w3m-sglang-observability-arg-defaults"
  ]
}
